{
  "schemaVersion": "AUDIT-LEGAL-HOLD-1.0.0",
  "holdId": "019d2c7d-4000-7000-8000-000000000014",
  "version": 1,
  "purpose": "approved-anonymous-conformance-investigation",
  "scope": "fixture:anonymous-fixture-2026-001",
  "authority": "fixture-compliance-authority",
  "startAt": "2026-06-01T00:00:00Z",
  "endAt": "2026-08-01T00:00:00Z",
  "reviewAt": "2026-07-01T00:00:00Z"
}
